Unnamed: 0_level_0,Unnamed: 1_level_0,Unnamed: 2_level_0,Unnamed: 3_level_0,April,April,April,April,April,May,May,May,May,May,June,June,June,June,June,July,July,July,July,July,August,August,August,August,August,September,September,September,September,September,October,October,October,October,October,November,November,November,November,November,December,December,December,December,December,January,January,January,January,January,February,February,February,February,February,March,March,March,March,March,Total,Total,Total,Total,Total
Unnamed: 0_level_1,Unnamed: 1_level_1,Unnamed: 2_level_1,Unnamed: 3_level_1,Total [(A+B) or (C+D)],Public [A],Private [B],Urban [C],Rural [D],Total [(A+B) or (C+D)],Public [A],Private [B],Urban [C],Rural [D],Total [(A+B) or (C+D)],Public [A],Private [B],Urban [C],Rural [D],Total [(A+B) or (C+D)],Public [A],Private [B],Urban [C],Rural [D],Total [(A+B) or (C+D)],Public [A],Private [B],Urban [C],Rural [D],Total [(A+B) or (C+D)],Public [A],Private [B],Urban [C],Rural [D],Total [(A+B) or (C+D)],Public [A],Private [B],Urban [C],Rural [D],Total [(A+B) or (C+D)],Public [A],Private [B],Urban [C],Rural [D],Total [(A+B) or (C+D)],Public [A],Private [B],Urban [C],Rural [D],Total [(A+B) or (C+D)],Public [A],Private [B],Urban [C],Rural [D],Total [(A+B) or (C+D)],Public [A],Private [B],Urban [C],Rural [D],Total [(A+B) or (C+D)],Public [A],Private [B],Urban [C],Rural [D],Total [(A+B) or (C+D)],Public [A],Private [B],Urban [C],Rural [D]
District,,,,,,,,,,,,,,,,,,,,,,,,,,,,,,,,,,,,,,,,,,,,,,,,,,,,,,,,,,,,,,,,,,,,
M/O Defence,1.1,Total number of pregnant women registered for ANC,TOTAL,,,,,,,,,,,,,,,,,,,,,,,,,,,,,,,,,,,,,,,,,,,,,,,,,,,,,,,,,,,,,,,,,
M/O Defence,1.1.1,"Out of the total ANC registered, number registered within 1st trimester (within 12 weeks)",TOTAL,,,,,,,,,,,,,,,,,,,,,,,,,,,,,,,,,,,,,,,,,,,,,,,,,,,,,,,,,,,,,,,,,
M/O Defence,1.2.1,Number of PW given TT1,TOTAL,,,,,,,,,,,,,,,,,,,,,,,,,,,,,,,,,,,,,,,,,,,,,,,,,,,,,,,,,,,,,,,,,
M/O Defence,1.2.2,Number of PW given TT2,TOTAL,,,,,,,,,,,,,,,,,,,,,,,,,,,,,,,,,,,,,,,,,,,,,,,,,,,,,,,,,,,,,,,,,
M/O Defence,1.2.3,Number of PW given TT Booster,TOTAL,,,,,,,,,,,,,,,,,,,,,,,,,,,,,,,,,,,,,,,,,,,,,,,,,,,,,,,,,,,,,,,,,
M/O Defence,1.2.4,Number of PW given 180 Iron Folic Acid (IFA) tablets,TOTAL,,,,,,,,,,,,,,,,,,,,,,,,,,,,,,,,,,,,,,,,,,,,,,,,,,,,,,,,,,,,,,,,,
M/O Defence,1.2.5,Number of PW given 360 Calcium tablets,TOTAL,,,,,,,,,,,,,,,,,,,,,,,,,,,,,,,,,,,,,,,,,,,,,,,,,,,,,,,,,,,,,,,,,
M/O Defence,1.2.6,Number of PW given one Albendazole tablet after 1st trimester,TOTAL,,,,,,,,,,,,,,,,,,,,,,,,,,,,,,,,,,,,,,,,,,,,,,,,,,,,,,,,,,,,,,,,,
M/O Defence,1.2.7,Number of PW received 4 or more ANC check ups,TOTAL,,,,,,,,,,,,,,,,,,,,,,,,,,,,,,,,,,,,,,,,,,,,,,,,,,,,,,,,,,,,,,,,,
M/O Defence,1.2.8,Number of PW given ANC Corticosteroids in Pre Term Labour,TOTAL,,,,,,,,,,,,,,,,,,,,,,,,,,,,,,,,,,,,,,,,,,,,,,,,,,,,,,,,,,,,,,,,,
M/O Defence,1.3.1,New cases of PW with hypertension detected,TOTAL,,,,,,,,,,,,,,,,,,,,,,,,,,,,,,,,,,,,,,,,,,,,,,,,,,,,,,,,,,,,,,,,,
M/O Defence,1.3.1.a,"Out of the new cases of PW with hypertension detected, cases managed at institution",TOTAL,,,,,,,,,,,,,,,,,,,,,,,,,,,,,,,,,,,,,,,,,,,,,,,,,,,,,,,,,,,,,,,,,
M/O Defence,1.3.2,Number of Eclampsia cases managed during delivery,TOTAL,,,,,,,,,,,,,,,,,,,,,,,,,,,,,,,,,,,,,,,,,,,,,,,,,,,,,,,,,,,,,,,,,
M/O Defence,1.4.1,Number of PW tested for Haemoglobin (Hb ) 4 or more than 4 times for respective ANCs,TOTAL,,,,,,,,,,,,,,,,,,,,,,,,,,,,,,,,,,,,,,,,,,,,,,,,,,,,,,,,,,,,,,,,,
M/O Defence,1.4.2,Number of PW having Hb level<11 (tested cases)(7.1 to 10.9),TOTAL,,,,,,,,,,,,,,,,,,,,,,,,,,,,,,,,,,,,,,,,,,,,,,,,,,,,,,,,,,,,,,,,,
M/O Defence,1.4.3,Number of PW having Hb level<7 (tested cases),TOTAL,,,,,,,,,,,,,,,,,,,,,,,,,,,,,,,,,,,,,,,,,,,,,,,,,,,,,,,,,,,,,,,,,
M/O Defence,1.4.4,Number of PW having severe anaemia (Hb<7) treated,TOTAL,,,,,,,,,,,,,,,,,,,,,,,,,,,,,,,,,,,,,,,,,,,,,,,,,,,,,,,,,,,,,,,,,
M/O Defence,1.5.1,Number of PW tested for blood sugar using OGTT (Oral Glucose Tolerance Test),TOTAL,,,,,,,,,,,,,,,,,,,,,,,,,,,,,,,,,,,,,,,,,,,,,,,,,,,,,,,,,,,,,,,,,
M/O Defence,1.5.2,Number of PW tested positive for GDM,TOTAL,,,,,,,,,,,,,,,,,,,,,,,,,,,,,,,,,,,,,,,,,,,,,,,,,,,,,,,,,,,,,,,,,
M/O Defence,1.5.3,Number of PW given insulin out of total tested positive for GDM,TOTAL,,,,,,,,,,,,,,,,,,,,,,,,,,,,,,,,,,,,,,,,,,,,,,,,,,,,,,,,,,,,,,,,,
M/O Defence,1.6.1.a,Number of PW tested using POC test for Syphilis,TOTAL,,,,,,,,,,,,,,,,,,,,,,,,,,,,,,,,,,,,,,,,,,,,,,,,,,,,,,,,,,,,,,,,,
M/O Defence,1.6.1.b,"Out of above, number of PW found sero positive for syphilis",TOTAL,,,,,,,,,,,,,,,,,,,,,,,,,,,,,,,,,,,,,,,,,,,,,,,,,,,,,,,,,,,,,,,,,
M/O Defence,1.6.2.a,Number of pregnant women tested for Syphilis,TOTAL,,,,,,,,,,,,,,,,,,,,,,,,,,,,,,,,,,,,,,,,,,,,,,,,,,,,,,,,,,,,,,,,,
M/O Defence,1.6.2.b,Number of pregnant women tested found sero positive for Syphilis,TOTAL,,,,,,,,,,,,,,,,,,,,,,,,,,,,,,,,,,,,,,,,,,,,,,,,,,,,,,,,,,,,,,,,,
M/O Defence,1.6.2.c,Number of syphilis positive pregnant women treated for Syphilis,TOTAL,,,,,,,,,,,,,,,,,,,,,,,,,,,,,,,,,,,,,,,,,,,,,,,,,,,,,,,,,,,,,,,,,
M/O Defence,1.6.2.d,Number of babies diagnosed with Congenital Syphilis,TOTAL,,,,,,,,,,,,,,,,,,,,,,,,,,,,,,,,,,,,,,,,,,,,,,,,,,,,,,,,,,,,,,,,,
M/O Defence,1.6.2.e,Number of babies treated for congenital Syphilis,TOTAL,,,,,,,,,,,,,,,,,,,,,,,,,,,,,,,,,,,,,,,,,,,,,,,,,,,,,,,,,,,,,,,,,
M/O Defence,2.1.1.a,Number of Home Deliveries attended by Skill Birth Attendant(SBA) (Doctor/Nurse/ANM),TOTAL,,,,,,,,,,,,,,,,,,,,,,,,,,,,,,,,,,,,,,,,,,,,,,,,,,,,,,,,,,,,,,,,,
M/O Defence,2.1.1.b,Number of Home Deliveries attended by Non SBA (Trained Birth Attendant(TBA) /Relatives/etc.),TOTAL,,,,,,,,,,,,,,,,,,,,,,,,,,,,,,,,,,,,,,,,,,,,,,,,,,,,,,,,,,,,,,,,,
M/O Defence,2.1.2,Number of PW given Tablet Misoprostol during home delivery,TOTAL,,,,,,,,,,,,,,,,,,,,,,,,,,,,,,,,,,,,,,,,,,,,,,,,,,,,,,,,,,,,,,,,,
M/O Defence,2.1.3,Number of newborns received 7 Home Based Newborn Care (HBNC) visits in case of Home delivery,TOTAL,,,,,,,,,,,,,,,,,,,,,,,,,,,,,,,,,,,,,,,,,,,,,,,,,,,,,,,,,,,,,,,,,
M/O Defence,2.2,Number of Institutional Deliveries conducted (Including C-Sections),TOTAL,,,,,,,,,,,,,,,,,,,,,,,,,,,,,,,,,,,,,,,,,,,,,,,,,,,,,,,,,,,,,,,,,
M/O Defence,2.2.1,Out of total institutional deliveries number of women discharged within 48 hours of delivery,TOTAL,,,,,,,,,,,,,,,,,,,,,,,,,,,,,,,,,,,,,,,,,,,,,,,,,,,,,,,,,,,,,,,,,
M/O Defence,2.2.2,Number of newborns received 6 HBNC visits after Institutional Delivery,TOTAL,,,,,,,,,,,,,,,,,,,,,,,,,,,,,,,,,,,,,,,,,,,,,,,,,,,,,,,,,,,,,,,,,
M/O Defence,3.1,Total C -Section deliveries performed,TOTAL,,,,,,,,,,,,,,,,,,,,,,,,,,,,,,,,,,,,,,,,,,,,,,,,,,,,,,,,,,,,,,,,,
M/O Defence,3.1.1,"C-sections, performed at night (8 PM- 8 AM)",TOTAL,,,,,,,,,,,,,,,,,,,,,,,,,,,,,,,,,,,,,,,,,,,,,,,,,,,,,,,,,,,,,,,,,
M/O Defence,4.1.1.a,Live Birth - Male,TOTAL,,,,,,,,,,,,,,,,,,,,,,,,,,,,,,,,,,,,,,,,,,,,,,,,,,,,,,,,,,,,,,,,,
M/O Defence,4.1.1.b,Live Birth - Female,TOTAL,,,,,,,,,,,,,,,,,,,,,,,,,,,,,,,,,,,,,,,,,,,,,,,,,,,,,,,,,,,,,,,,,
M/O Defence,4.1.2,Number of Pre term newborns ( < 37 weeks of pregnancy),TOTAL,,,,,,,,,,,,,,,,,,,,,,,,,,,,,,,,,,,,,,,,,,,,,,,,,,,,,,,,,,,,,,,,,
M/O Defence,4.1.3,Still Birth,TOTAL,,,,,,,,,,,,,,,,,,,,,,,,,,,,,,,,,,,,,,,,,,,,,,,,,,,,,,,,,,,,,,,,,
M/O Defence,4.2,Abortion (spontaneous),TOTAL,,,,,,,,,,,,,,,,,,,,,,,,,,,,,,,,,,,,,,,,,,,,,,,,,,,,,,,,,,,,,,,,,
M/O Defence,4.3.1.a,MTP up to 12 weeks of pregnancy,TOTAL,,,,,,,,,,,,,,,,,,,,,,,,,,,,,,,,,,,,,,,,,,,,,,,,,,,,,,,,,,,,,,,,,
M/O Defence,4.3.1.b,MTP more than 12 weeks of pregnancy,TOTAL,,,,,,,,,,,,,,,,,,,,,,,,,,,,,,,,,,,,,,,,,,,,,,,,,,,,,,,,,,,,,,,,,
M/O Defence,4.3.2.a,Post Abortion/ MTP Complications Identified,TOTAL,,,,,,,,,,,,,,,,,,,,,,,,,,,,,,,,,,,,,,,,,,,,,,,,,,,,,,,,,,,,,,,,,
M/O Defence,4.3.2.b,Post Abortion/ MTP Complications Treated,TOTAL,,,,,,,,,,,,,,,,,,,,,,,,,,,,,,,,,,,,,,,,,,,,,,,,,,,,,,,,,,,,,,,,,
M/O Defence,4.3.3,Number of women provided with post abortion/ MTP contraception,TOTAL,,,,,,,,,,,,,,,,,,,,,,,,,,,,,,,,,,,,,,,,,,,,,,,,,,,,,,,,,,,,,,,,,
M/O Defence,4.4.1,Number of newborns weighed at birth,TOTAL,,,,,,,,,,,,,,,,,,,,,,,,,,,,,,,,,,,,,,,,,,,,,,,,,,,,,,,,,,,,,,,,,
M/O Defence,4.4.2,Number of newborns having weight less than 2.5 kg,TOTAL,,,,,,,,,,,,,,,,,,,,,,,,,,,,,,,,,,,,,,,,,,,,,,,,,,,,,,,,,,,,,,,,,
M/O Defence,4.4.3,Number of Newborns breast fed within 1 hour of birth,TOTAL,,,,,,,,,,,,,,,,,,,,,,,,,,,,,,,,,,,,,,,,,,,,,,,,,,,,,,,,,,,,,,,,,
M/O Defence,5.1,"Number of cases of pregnant women with Obstetric Complications attended (Antepartum haemorrhage (APH), Post-Partum Hemorrhage (PPH), Sepsis, Eclampsia and others)",TOTAL,,,,,,,,,,,,,,,,,,,,,,,,,,,,,,,,,,,,,,,,,,,,,,,,,,,,,,,,,,,,,,,,,
M/O Defence,5.2,Number of Complicated pregnancies treated with Blood Transfusion,TOTAL,,,,,,,,,,,,,,,,,,,,,,,,,,,,,,,,,,,,,,,,,,,,,,,,,,,,,,,,,,,,,,,,,
M/O Defence,6.1,Women receiving 1st post partum checkup within 48 hours of home delivery,TOTAL,,,,,,,,,,,,,,,,,,,,,,,,,,,,,,,,,,,,,,,,,,,,,,,,,,,,,,,,,,,,,,,,,
M/O Defence,6.2,Women receiving 1st post partum checkup between 48 hours and 14 days,TOTAL,,,,,,,,,,,,,,,,,,,,,,,,,,,,,,,,,,,,,,,,,,,,,,,,,,,,,,,,,,,,,,,,,
M/O Defence,6.3,Number of mothers provided full course of 180 IFA tablets after delivery,TOTAL,,,,,,,,,,,,,,,,,,,,,,,,,,,,,,,,,,,,,,,,,,,,,,,,,,,,,,,,,,,,,,,,,
M/O Defence,6.4,Number of mothers provided 360 Calcium tablets after delivery,TOTAL,,,,,,,,,,,,,,,,,,,,,,,,,,,,,,,,,,,,,,,,,,,,,,,,,,,,,,,,,,,,,,,,,
M/O Defence,7.1.1,New RTI/STI cases identified - Male,TOTAL,,,,,,,,,,,,,,,,,,,,,,,,,,,,,,,,,,,,,,,,,,,,,,,,,,,,,,,,,,,,,,,,,
M/O Defence,7.1.2,New RTI/STI cases identified - Female,TOTAL,,,,,,,,,,,,,,,,,,,,,,,,,,,,,,,,,,,,,,,,,,,,,,,,,,,,,,,,,,,,,,,,,
M/O Defence,7.2.1,RTI/STI for which treatment initiated - Male,TOTAL,,,,,,,,,,,,,,,,,,,,,,,,,,,,,,,,,,,,,,,,,,,,,,,,,,,,,,,,,,,,,,,,,
M/O Defence,7.2.2,RTI/STI for which treatment initiated -Female,TOTAL,,,,,,,,,,,,,,,,,,,,,,,,,,,,,,,,,,,,,,,,,,,,,,,,,,,,,,,,,,,,,,,,,
M/O Defence,8.1.1,Number of Non Scalpel Vasectomy (NSV) / Conventional Vasectomy conducted,TOTAL,,,,,,,,,,,,,,,,,,,,,,,,,,,,,,,,,,,,,,,,,,,,,,,,,,,,,,,,,,,,,,,,,
M/O Defence,8.2.1,Number of Laparoscopic sterilizations (excluding post abortion) conducted,TOTAL,,,,,,,,,,,,,,,,,,,,,,,,,,,,,,,,,,,,,,,,,,,,,,,,,,,,,,,,,,,,,,,,,
M/O Defence,8.2.2,Number of Interval Mini-lap (other than post-partum and post abortion) sterilizations conducted,TOTAL,,,,,,,,,,,,,,,,,,,,,,,,,,,,,,,,,,,,,,,,,,,,,,,,,,,,,,,,,,,,,,,,,
M/O Defence,8.2.3,Number of Postpartum sterilizations (within 7 days of delivery by minilap or concurrent with caesarean section) conducted,TOTAL,,,,,,,,,,,,,,,,,,,,,,,,,,,,,,,,,,,,,,,,,,,,,,,,,,,,,,,,,,,,,,,,,
M/O Defence,8.2.4,Number of Post Abortion sterilizations (within 7 days of spontaneous or surgical abortion) conducted,TOTAL,,,,,,,,,,,,,,,,,,,,,,,,,,,,,,,,,,,,,,,,,,,,,,,,,,,,,,,,,,,,,,,,,
M/O Defence,8.3,Number of Interval IUCD Insertions (excluding PPIUCD and PAIUCD),TOTAL,,,,,,,,,,,,,,,,,,,,,,,,,,,,,,,,,,,,,,,,,,,,,,,,,,,,,,,,,,,,,,,,,
M/O Defence,8.4,Number of Postpartum (within 48 hours of delivery) IUCD insertions,TOTAL,,,,,,,,,,,,,,,,,,,,,,,,,,,,,,,,,,,,,,,,,,,,,,,,,,,,,,,,,,,,,,,,,
M/O Defence,8.5,Number of Post Abortion (within 12 days of spontaneous or surgical abortion) IUCD insertions,TOTAL,,,,,,,,,,,,,,,,,,,,,,,,,,,,,,,,,,,,,,,,,,,,,,,,,,,,,,,,,,,,,,,,,
M/O Defence,8.6,Number of IUCD Removals,TOTAL,,,,,,,,,,,,,,,,,,,,,,,,,,,,,,,,,,,,,,,,,,,,,,,,,,,,,,,,,,,,,,,,,
M/O Defence,8.7,Number of complications following IUCD Insertion,TOTAL,,,,,,,,,,,,,,,,,,,,,,,,,,,,,,,,,,,,,,,,,,,,,,,,,,,,,,,,,,,,,,,,,
M/O Defence,8.8,Injectable Contraceptive-Antara Program- First Dose,TOTAL,,,,,,,,,,,,,,,,,,,,,,,,,,,,,,,,,,,,,,,,,,,,,,,,,,,,,,,,,,,,,,,,,
M/O Defence,8.9,Injectable Contraceptive-Antara Program- Second Dose,TOTAL,,,,,,,,,,,,,,,,,,,,,,,,,,,,,,,,,,,,,,,,,,,,,,,,,,,,,,,,,,,,,,,,,
M/O Defence,8.10,Injectable Contraceptive-Antara Program- Third Dose,TOTAL,,,,,,,,,,,,,,,,,,,,,,,,,,,,,,,,,,,,,,,,,,,,,,,,,,,,,,,,,,,,,,,,,
M/O Defence,8.11,Injectable Contraceptive-Antara Program- Fourth or more than fourth,TOTAL,,,,,,,,,,,,,,,,,,,,,,,,,,,,,,,,,,,,,,,,,,,,,,,,,,,,,,,,,,,,,,,,,
M/O Defence,8.12,Number of Combined Oral Pill cycles distributed,TOTAL,,,,,,,,,,,,,,,,,,,,,,,,,,,,,,,,,,,,,,,,,,,,,,,,,,,,,,,,,,,,,,,,,
M/O Defence,8.13,Number of Condom pieces distributed,TOTAL,,,,,,,,,,,,,,,,,,,,,,,,,,,,,,,,,,,,,,,,,,,,,,,,,,,,,,,,,,,,,,,,,
M/O Defence,8.14,Number of Centchroman (weekly) pill strips distributed,TOTAL,,,,,,,,,,,,,,,,,,,,,,,,,,,,,,,,,,,,,,,,,,,,,,,,,,,,,,,,,,,,,,,,,
M/O Defence,8.15,Number of Emergency Contraceptive Pills (ECP) given,TOTAL,,,,,,,,,,,,,,,,,,,,,,,,,,,,,,,,,,,,,,,,,,,,,,,,,,,,,,,,,,,,,,,,,
M/O Defence,8.16,Number of Pregnancy Test Kits (PTK) used,TOTAL,,,,,,,,,,,,,,,,,,,,,,,,,,,,,,,,,,,,,,,,,,,,,,,,,,,,,,,,,,,,,,,,,
M/O Defence,8.17.1,Complications following male sterilization,TOTAL,,,,,,,,,,,,,,,,,,,,,,,,,,,,,,,,,,,,,,,,,,,,,,,,,,,,,,,,,,,,,,,,,
M/O Defence,8.17.2,Complications following female sterilization,TOTAL,,,,,,,,,,,,,,,,,,,,,,,,,,,,,,,,,,,,,,,,,,,,,,,,,,,,,,,,,,,,,,,,,
M/O Defence,8.17.3,Failures following male sterilization,TOTAL,,,,,,,,,,,,,,,,,,,,,,,,,,,,,,,,,,,,,,,,,,,,,,,,,,,,,,,,,,,,,,,,,
M/O Defence,8.17.4,Failures following female sterilization,TOTAL,,,,,,,,,,,,,,,,,,,,,,,,,,,,,,,,,,,,,,,,,,,,,,,,,,,,,,,,,,,,,,,,,
M/O Defence,8.17.5,Deaths following male sterilization,TOTAL,,,,,,,,,,,,,,,,,,,,,,,,,,,,,,,,,,,,,,,,,,,,,,,,,,,,,,,,,,,,,,,,,
M/O Defence,8.17.6,Deaths following female sterilization,TOTAL,,,,,,,,,,,,,,,,,,,,,,,,,,,,,,,,,,,,,,,,,,,,,,,,,,,,,,,,,,,,,,,,,
M/O Defence,9.1.1,Child immunisation - Vitamin K1 (Birth Dose),TOTAL,,,,,,,,,,,,,,,,,,,,,,,,,,,,,,,,,,,,,,,,,,,,,,,,,,,,,,,,,,,,,,,,,
M/O Defence,9.1.2,Child immunisation - BCG,TOTAL,,,,,,,,,,,,,,,,,,,,,,,,,,,,,,,,,,,,,,,,,,,,,,,,,,,,,,,,,,,,,,,,,
M/O Defence,9.1.3,Child immunisation - DPT1,TOTAL,,,,,,,,,,,,,,,,,,,,,,,,,,,,,,,,,,,,,,,,,,,,,,,,,,,,,,,,,,,,,,,,,
M/O Defence,9.1.4,Child immunisation - DPT2,TOTAL,,,,,,,,,,,,,,,,,,,,,,,,,,,,,,,,,,,,,,,,,,,,,,,,,,,,,,,,,,,,,,,,,
M/O Defence,9.1.5,Child immunisation - DPT3,TOTAL,,,,,,,,,,,,,,,,,,,,,,,,,,,,,,,,,,,,,,,,,,,,,,,,,,,,,,,,,,,,,,,,,
M/O Defence,9.1.6,Child immunisation - Pentavalent 1,TOTAL,,,,,,,,,,,,,,,,,,,,,,,,,,,,,,,,,,,,,,,,,,,,,,,,,,,,,,,,,,,,,,,,,
M/O Defence,9.1.7,Child immunisation - Pentavalent 2,TOTAL,,,,,,,,,,,,,,,,,,,,,,,,,,,,,,,,,,,,,,,,,,,,,,,,,,,,,,,,,,,,,,,,,
M/O Defence,9.1.8,Child immunisation - Pentavalent 3,TOTAL,,,,,,,,,,,,,,,,,,,,,,,,,,,,,,,,,,,,,,,,,,,,,,,,,,,,,,,,,,,,,,,,,
M/O Defence,9.1.9,Child immunisation - OPV 0 (Birth Dose),TOTAL,,,,,,,,,,,,,,,,,,,,,,,,,,,,,,,,,,,,,,,,,,,,,,,,,,,,,,,,,,,,,,,,,
M/O Defence,9.1.10,Child immunisation - OPV1,TOTAL,,,,,,,,,,,,,,,,,,,,,,,,,,,,,,,,,,,,,,,,,,,,,,,,,,,,,,,,,,,,,,,,,
M/O Defence,9.1.11,Child immunisation - OPV2,TOTAL,,,,,,,,,,,,,,,,,,,,,,,,,,,,,,,,,,,,,,,,,,,,,,,,,,,,,,,,,,,,,,,,,
M/O Defence,9.1.12,Child immunisation - OPV3,TOTAL,,,,,,,,,,,,,,,,,,,,,,,,,,,,,,,,,,,,,,,,,,,,,,,,,,,,,,,,,,,,,,,,,
M/O Defence,9.1.13,Child immunisation - Hepatitis-B0 (Birth Dose),TOTAL,,,,,,,,,,,,,,,,,,,,,,,,,,,,,,,,,,,,,,,,,,,,,,,,,,,,,,,,,,,,,,,,,
M/O Defence,9.1.14,Child immunisation - Hepatitis-B1,TOTAL,,,,,,,,,,,,,,,,,,,,,,,,,,,,,,,,,,,,,,,,,,,,,,,,,,,,,,,,,,,,,,,,,
M/O Defence,9.1.15,Child immunisation - Hepatitis-B2,TOTAL,,,,,,,,,,,,,,,,,,,,,,,,,,,,,,,,,,,,,,,,,,,,,,,,,,,,,,,,,,,,,,,,,
M/O Defence,9.1.16,Child immunisation - Hepatitis-B3,TOTAL,,,,,,,,,,,,,,,,,,,,,,,,,,,,,,,,,,,,,,,,,,,,,,,,,,,,,,,,,,,,,,,,,
M/O Defence,9.1.17,Child immunisation - Inactivated Polio Vaccine 1 (IPV 1),TOTAL,,,,,,,,,,,,,,,,,,,,,,,,,,,,,,,,,,,,,,,,,,,,,,,,,,,,,,,,,,,,,,,,,
M/O Defence,9.1.18,Child immunisation - Inactivated Polio Vaccine 2 (IPV 2),TOTAL,,,,,,,,,,,,,,,,,,,,,,,,,,,,,,,,,,,,,,,,,,,,,,,,,,,,,,,,,,,,,,,,,
M/O Defence,9.1.19,Child immunisation - Rotavirus 1,TOTAL,,,,,,,,,,,,,,,,,,,,,,,,,,,,,,,,,,,,,,,,,,,,,,,,,,,,,,,,,,,,,,,,,
M/O Defence,9.1.20,Child immunisation - Rotavirus 2,TOTAL,,,,,,,,,,,,,,,,,,,,,,,,,,,,,,,,,,,,,,,,,,,,,,,,,,,,,,,,,,,,,,,,,
M/O Defence,9.1.21,Child immunisation - Rotavirus 3,TOTAL,,,,,,,,,,,,,,,,,,,,,,,,,,,,,,,,,,,,,,,,,,,,,,,,,,,,,,,,,,,,,,,,,
M/O Defence,9.2.1,Child immunisation (9-11months) - Measles & Rubella (MR)- 1st Dose,TOTAL,,,,,,,,,,,,,,,,,,,,,,,,,,,,,,,,,,,,,,,,,,,,,,,,,,,,,,,,,,,,,,,,,
M/O Defence,9.2.2,Child immunisation (9-11months) - Measles 1st dose,TOTAL,,,,,,,,,,,,,,,,,,,,,,,,,,,,,,,,,,,,,,,,,,,,,,,,,,,,,,,,,,,,,,,,,
M/O Defence,9.2.3,Child immunisation (9-11months) - JE 1st dose,TOTAL,,,,,,,,,,,,,,,,,,,,,,,,,,,,,,,,,,,,,,,,,,,,,,,,,,,,,,,,,,,,,,,,,
M/O Defence,9.2.4.a,Children aged between 9 and 11 months fully immunized- Male,TOTAL,,,,,,,,,,,,,,,,,,,,,,,,,,,,,,,,,,,,,,,,,,,,,,,,,,,,,,,,,,,,,,,,,
M/O Defence,9.2.4.b,Children aged between 9 and 11 months fully immunized - Female,TOTAL,,,,,,,,,,,,,,,,,,,,,,,,,,,,,,,,,,,,,,,,,,,,,,,,,,,,,,,,,,,,,,,,,
M/O Defence,9.3.1,Child immunisation - Measles & Rubella (MR)- 1st Dose,TOTAL,,,,,,,,,,,,,,,,,,,,,,,,,,,,,,,,,,,,,,,,,,,,,,,,,,,,,,,,,,,,,,,,,
M/O Defence,9.3.2,Child immunisation - Measles-1st dose,TOTAL,,,,,,,,,,,,,,,,,,,,,,,,,,,,,,,,,,,,,,,,,,,,,,,,,,,,,,,,,,,,,,,,,
M/O Defence,9.3.3,Child immunisation - JE 1st dose,TOTAL,,,,,,,,,,,,,,,,,,,,,,,,,,,,,,,,,,,,,,,,,,,,,,,,,,,,,,,,,,,,,,,,,
M/O Defence,9.4.1,Child immunisation - Measles & Rubella (MR)- 2nd Dose (16-24 months),TOTAL,,,,,,,,,,,,,,,,,,,,,,,,,,,,,,,,,,,,,,,,,,,,,,,,,,,,,,,,,,,,,,,,,
M/O Defence,9.4.2,Child immunisation - Measles 2nd dose (More than 16 months),TOTAL,,,,,,,,,,,,,,,,,,,,,,,,,,,,,,,,,,,,,,,,,,,,,,,,,,,,,,,,,,,,,,,,,
M/O Defence,9.4.3,Child immunisation - DPT 1st Booster,TOTAL,,,,,,,,,,,,,,,,,,,,,,,,,,,,,,,,,,,,,,,,,,,,,,,,,,,,,,,,,,,,,,,,,
M/O Defence,9.4.4,Child immunisation - OPV Booster,TOTAL,,,,,,,,,,,,,,,,,,,,,,,,,,,,,,,,,,,,,,,,,,,,,,,,,,,,,,,,,,,,,,,,,
M/O Defence,9.4.5,"Child immunisation - Measles, Mumps, Rubella (MMR) Vaccine",TOTAL,,,,,,,,,,,,,,,,,,,,,,,,,,,,,,,,,,,,,,,,,,,,,,,,,,,,,,,,,,,,,,,,,
M/O Defence,9.4.6,Number of children more than 16 months of age who received Japanese Encephalitis (JE) vaccine,TOTAL,,,,,,,,,,,,,,,,,,,,,,,,,,,,,,,,,,,,,,,,,,,,,,,,,,,,,,,,,,,,,,,,,
M/O Defence,9.5.1,Child immunisation - Typhoid,TOTAL,,,,,,,,,,,,,,,,,,,,,,,,,,,,,,,,,,,,,,,,,,,,,,,,,,,,,,,,,,,,,,,,,
M/O Defence,9.5.2,Children more than 5 years received DPT5 (2nd Booster),TOTAL,,,,,,,,,,,,,,,,,,,,,,,,,,,,,,,,,,,,,,,,,,,,,,,,,,,,,,,,,,,,,,,,,
M/O Defence,9.5.3,Children more than 10 years received TT10,TOTAL,,,,,,,,,,,,,,,,,,,,,,,,,,,,,,,,,,,,,,,,,,,,,,,,,,,,,,,,,,,,,,,,,
M/O Defence,9.5.4,Children more than 16 years received TT16,TOTAL,,,,,,,,,,,,,,,,,,,,,,,,,,,,,,,,,,,,,,,,,,,,,,,,,,,,,,,,,,,,,,,,,
M/O Defence,9.6.1,Number of cases of AEFI - Abscess,TOTAL,,,,,,,,,,,,,,,,,,,,,,,,,,,,,,,,,,,,,,,,,,,,,,,,,,,,,,,,,,,,,,,,,
M/O Defence,9.6.2,Number of cases of AEFI - Death,TOTAL,,,,,,,,,,,,,,,,,,,,,,,,,,,,,,,,,,,,,,,,,,,,,,,,,,,,,,,,,,,,,,,,,
M/O Defence,9.6.3,Number of cases of AEFI - Others,TOTAL,,,,,,,,,,,,,,,,,,,,,,,,,,,,,,,,,,,,,,,,,,,,,,,,,,,,,,,,,,,,,,,,,
M/O Defence,9.7.1,Immunisation sessions planned,TOTAL,,,,,,,,,,,,,,,,,,,,,,,,,,,,,,,,,,,,,,,,,,,,,,,,,,,,,,,,,,,,,,,,,
M/O Defence,9.7.2,Immunisation sessions held,TOTAL,,,,,,,,,,,,,,,,,,,,,,,,,,,,,,,,,,,,,,,,,,,,,,,,,,,,,,,,,,,,,,,,,
M/O Defence,9.7.3,Number of Immunisation sessions where ASHAs were present,TOTAL,,,,,,,,,,,,,,,,,,,,,,,,,,,,,,,,,,,,,,,,,,,,,,,,,,,,,,,,,,,,,,,,,
M/O Defence,9.8.1,Child immunisation - Vitamin A Dose - 1,TOTAL,,,,,,,,,,,,,,,,,,,,,,,,,,,,,,,,,,,,,,,,,,,,,,,,,,,,,,,,,,,,,,,,,
M/O Defence,9.8.2,Child immunisation - Vitamin A Dose - 5,TOTAL,,,,,,,,,,,,,,,,,,,,,,,,,,,,,,,,,,,,,,,,,,,,,,,,,,,,,,,,,,,,,,,,,
M/O Defence,9.8.3,Child immunisation - Vitamin A Dose - 9,TOTAL,,,,,,,,,,,,,,,,,,,,,,,,,,,,,,,,,,,,,,,,,,,,,,,,,,,,,,,,,,,,,,,,,
M/O Defence,9.9,Number of children (6-59 months) provided 8-10 doses (1ml) of IFA syrup (Bi weekly),TOTAL,,,,,,,,,,,,,,,,,,,,,,,,,,,,,,,,,,,,,,,,,,,,,,,,,,,,,,,,,,,,,,,,,
M/O Defence,9.10,Number of children (12-59 months) provided Albendazole,TOTAL,,,,,,,,,,,,,,,,,,,,,,,,,,,,,,,,,,,,,,,,,,,,,,,,,,,,,,,,,,,,,,,,,
M/O Defence,9.11,Number of severely underweight children provided Health Checkup (0-5 yrs),TOTAL,,,,,,,,,,,,,,,,,,,,,,,,,,,,,,,,,,,,,,,,,,,,,,,,,,,,,,,,,,,,,,,,,
M/O Defence,10.1,Childhood Diseases - Pneumonia,TOTAL,,,,,,,,,,,,,,,,,,,,,,,,,,,,,,,,,,,,,,,,,,,,,,,,,,,,,,,,,,,,,,,,,
M/O Defence,10.2,Childhood Diseases - Asthma,TOTAL,,,,,,,,,,,,,,,,,,,,,,,,,,,,,,,,,,,,,,,,,,,,,,,,,,,,,,,,,,,,,,,,,
M/O Defence,10.3,Childhood Diseases - Sepsis,TOTAL,,,,,,,,,,,,,,,,,,,,,,,,,,,,,,,,,,,,,,,,,,,,,,,,,,,,,,,,,,,,,,,,,
M/O Defence,10.4,Childhood Diseases - Diphtheria,TOTAL,,,,,,,,,,,,,,,,,,,,,,,,,,,,,,,,,,,,,,,,,,,,,,,,,,,,,,,,,,,,,,,,,
M/O Defence,10.5,Childhood Diseases - Pertussis,TOTAL,,,,,,,,,,,,,,,,,,,,,,,,,,,,,,,,,,,,,,,,,,,,,,,,,,,,,,,,,,,,,,,,,
M/O Defence,10.6,Childhood Diseases - Tetanus Neonatorum,TOTAL,,,,,,,,,,,,,,,,,,,,,,,,,,,,,,,,,,,,,,,,,,,,,,,,,,,,,,,,,,,,,,,,,
M/O Defence,10.7,Childhood Diseases - Tuberculosis (TB),TOTAL,,,,,,,,,,,,,,,,,,,,,,,,,,,,,,,,,,,,,,,,,,,,,,,,,,,,,,,,,,,,,,,,,
M/O Defence,10.8,Childhood Diseases - Acute Flaccid Paralysis(AFP),TOTAL,,,,,,,,,,,,,,,,,,,,,,,,,,,,,,,,,,,,,,,,,,,,,,,,,,,,,,,,,,,,,,,,,
M/O Defence,10.9,Childhood Diseases - Measles,TOTAL,,,,,,,,,,,,,,,,,,,,,,,,,,,,,,,,,,,,,,,,,,,,,,,,,,,,,,,,,,,,,,,,,
M/O Defence,10.10,Childhood Diseases - Malaria,TOTAL,,,,,,,,,,,,,,,,,,,,,,,,,,,,,,,,,,,,,,,,,,,,,,,,,,,,,,,,,,,,,,,,,
M/O Defence,10.11,Childhood Diseases - Diarrhoea,TOTAL,,,,,,,,,,,,,,,,,,,,,,,,,,,,,,,,,,,,,,,,,,,,,,,,,,,,,,,,,,,,,,,,,
M/O Defence,10.12,Childhood Diseases - Diarrhoea treated in Inpatients,TOTAL,,,,,,,,,,,,,,,,,,,,,,,,,,,,,,,,,,,,,,,,,,,,,,,,,,,,,,,,,,,,,,,,,
M/O Defence,10.13,Children admitted with upper respiratory infections,TOTAL,,,,,,,,,,,,,,,,,,,,,,,,,,,,,,,,,,,,,,,,,,,,,,,,,,,,,,,,,,,,,,,,,
M/O Defence,10.14,Childhood Diseases - Severe Acute Malnutrition (SAM),TOTAL,,,,,,,,,,,,,,,,,,,,,,,,,,,,,,,,,,,,,,,,,,,,,,,,,,,,,,,,,,,,,,,,,
M/O Defence,11.1.1.a,Total Blood Smears Examined for Malaria,TOTAL,,,,,,,,,,,,,,,,,,,,,,,,,,,,,,,,,,,,,,,,,,,,,,,,,,,,,,,,,,,,,,,,,
M/O Defence,11.1.1.b,Malaria (Microscopy Tests ) - Plasmodium Vivax test positive,TOTAL,,,,,,,,,,,,,,,,,,,,,,,,,,,,,,,,,,,,,,,,,,,,,,,,,,,,,,,,,,,,,,,,,
M/O Defence,11.1.1.c,Malaria (Microscopy Tests ) - Plasmodium Falciparum test positive,TOTAL,,,,,,,,,,,,,,,,,,,,,,,,,,,,,,,,,,,,,,,,,,,,,,,,,,,,,,,,,,,,,,,,,
M/O Defence,11.1.2.a,RDT conducted for Malaria,TOTAL,,,,,,,,,,,,,,,,,,,,,,,,,,,,,,,,,,,,,,,,,,,,,,,,,,,,,,,,,,,,,,,,,
M/O Defence,11.1.2.b,Malaria (RDT) - Plasmodium Vivax test positive,TOTAL,,,,,,,,,,,,,,,,,,,,,,,,,,,,,,,,,,,,,,,,,,,,,,,,,,,,,,,,,,,,,,,,,
M/O Defence,11.1.2.c,Malaria (RDT) - Plamodium Falciparum test positive,TOTAL,,,,,,,,,,,,,,,,,,,,,,,,,,,,,,,,,,,,,,,,,,,,,,,,,,,,,,,,,,,,,,,,,
M/O Defence,11.2.1,Kala Azar (RDT) - Tests Conducted,TOTAL,,,,,,,,,,,,,,,,,,,,,,,,,,,,,,,,,,,,,,,,,,,,,,,,,,,,,,,,,,,,,,,,,
M/O Defence,11.2.2,Kala Azar Positive Cases,TOTAL,,,,,,,,,,,,,,,,,,,,,,,,,,,,,,,,,,,,,,,,,,,,,,,,,,,,,,,,,,,,,,,,,
M/O Defence,11.2.3,Post-kala-azar dermal leishmaniasis (PKDL) cases,TOTAL,,,,,,,,,,,,,,,,,,,,,,,,,,,,,,,,,,,,,,,,,,,,,,,,,,,,,,,,,,,,,,,,,
M/O Defence,11.3.1,Dengue - RDT Test Positive,TOTAL,,,,,,,,,,,,,,,,,,,,,,,,,,,,,,,,,,,,,,,,,,,,,,,,,,,,,,,,,,,,,,,,,
M/O Defence,11.3.2,Dengue - Enzyme- Linked Immuno Sorbent Assay (ELISA) Test Positive,TOTAL,,,,,,,,,,,,,,,,,,,,,,,,,,,,,,,,,,,,,,,,,,,,,,,,,,,,,,,,,,,,,,,,,
M/O Defence,11.4.1,Tests Conducted for JE,TOTAL,,,,,,,,,,,,,,,,,,,,,,,,,,,,,,,,,,,,,,,,,,,,,,,,,,,,,,,,,,,,,,,,,
M/O Defence,11.4.2,Tests Positive for JE,TOTAL,,,,,,,,,,,,,,,,,,,,,,,,,,,,,,,,,,,,,,,,,,,,,,,,,,,,,,,,,,,,,,,,,
M/O Defence,12.1.1.a,Girls registered in AFHC,TOTAL,,,,,,,,,,,,,,,,,,,,,,,,,,,,,,,,,,,,,,,,,,,,,,,,,,,,,,,,,,,,,,,,,
M/O Defence,12.1.1.b,Boys registered in AFHC,TOTAL,,,,,,,,,,,,,,,,,,,,,,,,,,,,,,,,,,,,,,,,,,,,,,,,,,,,,,,,,,,,,,,,,
M/O Defence,12.1.2.a,"Out of registered, Girls received clinical services",TOTAL,,,,,,,,,,,,,,,,,,,,,,,,,,,,,,,,,,,,,,,,,,,,,,,,,,,,,,,,,,,,,,,,,
M/O Defence,12.1.2.b,"Out of registered, Boys received clinical services",TOTAL,,,,,,,,,,,,,,,,,,,,,,,,,,,,,,,,,,,,,,,,,,,,,,,,,,,,,,,,,,,,,,,,,
M/O Defence,12.1.3.a,"Out of registered, Girls received counselling",TOTAL,,,,,,,,,,,,,,,,,,,,,,,,,,,,,,,,,,,,,,,,,,,,,,,,,,,,,,,,,,,,,,,,,
M/O Defence,12.1.3.b,"Out of registered, Boys received counselling",TOTAL,,,,,,,,,,,,,,,,,,,,,,,,,,,,,,,,,,,,,,,,,,,,,,,,,,,,,,,,,,,,,,,,,
M/O Defence,13.1,Number of on-going DOTS patients registered,TOTAL,,,,,,,,,,,,,,,,,,,,,,,,,,,,,,,,,,,,,,,,,,,,,,,,,,,,,,,,,,,,,,,,,
M/O Defence,13.2,Number of DOTS cases completed successfully,TOTAL,,,,,,,,,,,,,,,,,,,,,,,,,,,,,,,,,,,,,,,,,,,,,,,,,,,,,,,,,,,,,,,,,
M/O Defence,14.1.1,Outpatient - Diabetes,TOTAL,,,,,,,,,,,,,,,,,,,,,,,,,,,,,,,,,,,,,,,,,,,,,,,,,,,,,,,,,,,,,,,,,
M/O Defence,14.1.2,Outpatient - Hypertension,TOTAL,,,,,,,,,,,,,,,,,,,,,,,,,,,,,,,,,,,,,,,,,,,,,,,,,,,,,,,,,,,,,,,,,
M/O Defence,14.1.3,Outpatient - Stroke (Paralysis),TOTAL,,,,,,,,,,,,,,,,,,,,,,,,,,,,,,,,,,,,,,,,,,,,,,,,,,,,,,,,,,,,,,,,,
M/O Defence,14.1.4,Outpatient - Acute Heart Diseases,TOTAL,,,,,,,,,,,,,,,,,,,,,,,,,,,,,,,,,,,,,,,,,,,,,,,,,,,,,,,,,,,,,,,,,
M/O Defence,14.1.5,Outpatient - Mental illness,TOTAL,,,,,,,,,,,,,,,,,,,,,,,,,,,,,,,,,,,,,,,,,,,,,,,,,,,,,,,,,,,,,,,,,
M/O Defence,14.1.6,Outpatient - Epilepsy,TOTAL,,,,,,,,,,,,,,,,,,,,,,,,,,,,,,,,,,,,,,,,,,,,,,,,,,,,,,,,,,,,,,,,,
M/O Defence,14.1.7,Outpatient - Ophthalmic Related,TOTAL,,,,,,,,,,,,,,,,,,,,,,,,,,,,,,,,,,,,,,,,,,,,,,,,,,,,,,,,,,,,,,,,,
M/O Defence,14.1.8,Outpatient - Dental,TOTAL,,,,,,,,,,,,,,,,,,,,,,,,,,,,,,,,,,,,,,,,,,,,,,,,,,,,,,,,,,,,,,,,,
